{"allowedCommands":[{"capability":"migrate","commandId":"db.migrate.deploy","commandVersion":"1"},{"capability":"verify","commandId":"db.schema.verify","commandVersion":"1"}],"allowedTargets":[{"databaseName":"s1ci_stage1_r2_20260927","endpoint":"127.0.0.1:55439","endpointPolicyId":"stage1-r2-synthetic-20260927","purposes":["synthetic-fresh"],"roles":{"migrate":"stage1_r2_migrate","observer":"stage1_r2_observer","verify":"stage1_r2_verify"},"tls":"required"}],"buildTrust":{"oidcIssuer":"https://token.actions.githubusercontent.com","repository":"keqi119/subscription-Saas","runnerClass":"github-hosted","sourceRef":"refs/heads/main","workflow":"keqi119/subscription-Saas/.github/workflows/docker-images.yml"},"expiresAt":"2026-10-27T03:39:03.374Z","keyFingerprint":"sha256:7146f2e00f4a8e70183a64f3e8c7ebfa8e66926f60d18442e3d5ac4a09e408ef","ownerId":"keqi119","profileId":"9773e084-466a-41de-9bdb-7de7ec8719c6","publicKeyPem":"-----BEGIN PUBLIC KEY-----\nMCowBQYDK2VwAyEA5xzYK8RyeLxcvnpZ2gDgt4qId4ZO/PXwZXRgZUlXKTs=\n-----END PUBLIC KEY-----\n","schemaVersion":"manual-stage1-profile.v2","storage":{"archiveRoot":"/var/lib/stage1-volumes/main/archive","backupRoot":"/var/lib/stage1-volumes/recovery/backup","credentialRoot":"/var/lib/stage1-volumes/main/credential","journalRoot":"/var/lib/stage1-volumes/main/journal","keyRef":"signing-ed25519.pk8.pem","keyRoot":"/var/lib/stage1-volumes/main/key","retentionDays":90},"validFrom":"2026-09-27T03:39:03.374Z"}